{
  "version": "0.3.0-draft",
  "jornada": {
    "contexto": "Um agente de atendimento coleta contexto e entrega casos comerciais a um agente de vendas.",
    "objetivo_de_negocio": "Preservar contexto entre agentes e reduzir repetição para o cliente.",
    "estado_atual": "Os agentes têm funções diferentes e o segundo não deve assumir fatos não confirmados pelo primeiro.",
    "historico_relevante": [],
    "tentativas_anteriores": [],
    "recursos_disponiveis": [],
    "restricoes_conhecidas": [],
    "incertezas": [],
    "itens_de_contexto": [
      {"value":"Cliente pediu orçamento.","confidence_state":"confirmed","source":"mensagem do cliente"},
      {"value":"Cliente parece ter urgência.","confidence_state":"inferred","source":"interpretação do atendimento"}
    ]
  },
  "precisao": {
    "objetivo": "Definir contrato de handoff entre agentes.",
    "escopo": {
      "inclui": ["resumo factual", "itens de contexto com confiança", "lacunas", "ação solicitada ao próximo agente"],
      "nao_inclui": ["transferir raciocínio privado", "promover inferência a confirmado"]
    },
    "entradas": [],
    "saidas": ["payload de handoff", "regras de consumo", "critérios para rejeitar handoff incompleto"],
    "restricoes": [],
    "criterios_de_aceitacao": ["Estados de confiança são preservados.", "O agente receptor pode identificar lacunas."],
    "riscos": ["perda de provenance", "inferência silenciosa"],
    "validacao": ["simular handoff completo, incompleto e conflitante"]
  },
  "narrativa": {
    "estado_final_desejado": "Agente receptor recebe contexto suficiente, rastreável e com confiança preservada.",
    "sequencia_de_entrega": [],
    "formato_da_resposta": "Contrato de handoff + exemplo JSON",
    "nivel_de_detalhe": "Detalhado",
    "proxima_acao": "Implementar contrato em ambiente de teste.",
    "continuidade": []
  }
}