{
  "version": "0.3.0-draft",
  "jornada": {
    "contexto": "Equipe copia dados de pedidos aprovados para uma planilha operacional.",
    "objetivo_de_negocio": "Reduzir trabalho manual sem automatizar decisões financeiras.",
    "estado_atual": "A aprovação do pedido acontece em outro sistema e deve permanecer humana/sistêmica.",
    "historico_relevante": [],
    "tentativas_anteriores": [],
    "recursos_disponiveis": [],
    "restricoes_conhecidas": ["Somente pedidos já aprovados entram no fluxo."],
    "incertezas": [],
    "itens_de_contexto": []
  },
  "precisao": {
    "objetivo": "Projetar automação de transferência e validação de dados.",
    "escopo": {
      "inclui": ["ler pedidos já aprovados", "validar campos", "registrar na planilha", "logar falhas"],
      "nao_inclui": ["aprovar pedidos", "alterar valores", "usar credenciais fora do fluxo autorizado"]
    },
    "entradas": [],
    "saidas": ["fluxo de automação", "regras de validação", "tratamento de erro", "trilha de auditoria"],
    "restricoes": [],
    "criterios_de_aceitacao": ["Nenhum pedido é aprovado pela automação.", "Falhas são registradas e não descartadas silenciosamente."],
    "riscos": ["duplicidade", "campos incompletos", "processamento repetido"],
    "validacao": ["testar idempotência", "testar pedido incompleto", "testar falha de destino"]
  },
  "narrativa": {
    "estado_final_desejado": "Transferência automatizada, auditável e sem ampliar autoridade do fluxo.",
    "sequencia_de_entrega": [],
    "formato_da_resposta": "Fluxo + regras",
    "nivel_de_detalhe": "Detalhado",
    "proxima_acao": "Executar piloto com dados fictícios.",
    "continuidade": []
  }
}